name,website,street_address,city,region,postal_code,country,phones,emails,whatsapp,social_links,opening_hours,materials,material_prices,description
Houston Iron Recycling with Gulf Coast Scrap Metal,https://houstontexasiron.com/,"4111
8770 Hempstead Road",Houston,TX,77008,United States,['(713) 868-4111'],[],[],[],,"['Scrap Metal', 'Iron']",[],Houston iron recycling center – Gulf Coast Scrap Metal – has the best scrap iron prices in town. Please call 713-868-4111.
INDUSTRIAL DEMOLITON,https://texassalvageandsurplusbuyers.com/industrial-demoliton-houston-tx/,,,,,United States,['(832) 356-9014'],[],[],[],,"['Aluminum', 'Lead', 'Battery', 'Scrap Metal', 'Steel', 'Stainless Steel', 'Copper', 'Iron']",[],Industrial Demolition Houston TX. We do industrial demolition in Houston. We offer free written estimates. Scrap Metal Salvage demolition.
San Antonio Scrap Metal Removal ~ Texas,https://goloadup.com/san-antonio/scrap-metal-removal/,85 NE Interstate 410 Loop #404,San Antonio,TX,78216,United States,"['(844) 239-7711', '(404) 947-6060']",[],[],[],Monday – Sunday 8:00 AM – 8:00 PM EST,"['Appliance', 'Lead', 'Scrap Metal', 'Electronic', 'Iron']",[],"From heavy metal debris to old appliances, we haul it all in San Antonio, TX. Count on our background-checked team for reliable scrap metal removal and disposal."
Houston TX Aluminum Recycling Center,https://astrocityscrap.com/houston-tx-aluminum-recycling-center/,4530 North Shepherd Houst,on,TX,77018,United States,['(713) 697-2999'],['donbuntin1@gmail.com'],[],[],,"['Brass', 'Aluminum', 'Scrap Metal', 'Steel', 'Stainless Steel', 'Copper', 'Iron']",[],"Houston TX Aluminum Recycling Center, Astro City Scrap Metal will pay you top dollar for your scrap metal in CASH! Call now!"
Houston’s E-Waste Recycling Centers: What to Expect,https://ecircular.com/houstons-e-waste-recycling-centers/,"2025 



eCircular 














455 W 38th St",Houston,TX,77018,United States,"['(800) 356-8933', '(713) 660-1815']","['info@ecircular.com', 'office@tecnologia.com']",[],[],,"['Electronic', 'Battery', 'Iron']",[],Becoming familiar with these centers and how they operate can ensure a smooth recycling experience while contributing to a sustainable future.
Recycling,https://dfwrolloff.com/services/recycling/,12021 Jacksboro Hwy,Fort Worth,TX,76135,United States,['(817) 369-3068'],[],[],[],,['Iron'],[],
Metal recycling dallas tx,https://www.actionmetalsrecyclers.com/,3514 Botham Jean Blvd,Dallas,TX,75215,United States,"['(214) 421-9932', '(214) 421-9981', '(469) 490-0079']","['boris@actionmetalsinc.com', 'officestaff@actionmetalsinc.com']",[],[],Mon-Fri : 8am - 6:00pm Sat : 8am - 4:30pm Sun : 8am - 12:30pm,"['Brass', 'Aluminum', 'Lead', 'Scrap Metal', 'Steel', 'Stainless Steel', 'Copper', 'Iron']",[],"Choose Action Metal Recyclers for top-notch metal recycling in Dallas, TX. Contact us now for great rates and more information."
Residential E-Waste Recycling,https://compucycle.com/residential-electronics-recycling/,8019 Kempwood Dr,Houston,TX,77055,United States,"['(888) 314-7922', '(713) 999-4671', '(713) 869-6700']","['info@compucycle.com', '713-866-8033info@compucycle.comour']",[],[],,"['Appliance', 'Electronic', 'Iron']",[],"Safely recycle your personal electronics with CompuCycle’s residential recycling program. We provide secure and eco-friendly disposal for old devices, ensuring responsible e-waste management while protecting your data and the environment."
Dallas Scrap Metal Buyers & Recycling Centers,https://scrapvisor.com/texas/dallas/,"0








Ocean Star Metals
2019 Ruder St",Dallas,TX,75212,United States,"['(972) 303-8388', '(214) 421-9981', '(972) 869-0802']",[],[],[],,"['Zinc', 'Brass', 'Aluminum', 'Lead', 'Scrap Metal', 'Steel', 'Stainless Steel', 'Copper', 'Iron']",[],"Find trusted scrap metal buyers and recycling centers in Dallas. View up-to-date scrap metal prices, explore our interactive map of local scrap yards, and connect with reputable companies for fast and profitable scrap sales."
"Electronic Recycling in Houston, TX",https://therecycleguide.org/electronic-recycling/houston-tx/,,,,,United States,['(855) 713-6280'],[],[],[],,"['Appliance', 'Lead', 'Battery', 'Electronic', 'Iron']",[],
Dallas’ Trusted Source for Quality Used Auto Parts & Salvage Vehicles,https://aaaautorecyclers.com/,1753 S Beltline Rd,Dallas,TX,75253,United States,[],[],[],[],,['Auto Parts'],[],"Design a professional mechanic site with Avada. Showcase services, customer testimonials, and expertise effortlessly. Perfect for auto repair shops."
"Houston, Texas - 77049 Local Recycling Centers",https://recyclingcenters.org/Texas/Houston_77049_recycling_centers.php,"10217 Wallisville Rd
                                                                Houst",on,TX,77013,United States,[],[],[],[],,"['Appliance', 'Aluminum', 'Scrap Metal', 'Electronic', 'Iron']",[],"Houston, Texas 77049 Local Recycling Centers and Recycling Information and Statistics"
"A Premier Dumpster Rental and Scrap Metal Service in Houston, TX",https://www.essential-waste.com/,,,,,United States,['(713) 702-1860'],[],[],[],,"['Aluminum', 'Scrap Metal', 'Steel', 'Copper', 'Iron']",[],Efficient dumpster rental and disposal of scrap metals. Call now!
Global Leaders in Scrap Metal Recycling and Supply,https://goldstarmetals.com/,15911 Wood Drive,Channelview,TX,77530,United States,['(713) 633-6800'],[],[],[],,"['Brass', 'Aluminum', 'Lead', 'Scrap Metal', 'Steel', 'Copper', 'Iron']",[],"Gold Star Metals offers top scrap metal recycling services in Texas. We provide eco-friendly solutions to streamline operations, reduce waste, and maximize value."
A & R Scrap Metal Recycling CompanyScrap Metal Buyer in Dallas,https://www.armetalrecyclers.com/Dallas.html,,,,,United States,['(713) 410-8333'],[],[],[],,['Scrap Metal'],[],"A & R Scrap Metal Recycling Company, scrap metal buyer in Dallas, scrap metal recycler, recycle scrap metal, scrap metal prices, scrap buyer, Dallas, TX"
Get Paid for Aluminum Metal Recycling at Gulf Coast Scrap Metal,https://www.houstonaluminum.com/,"4111
8770 Hempstead Road",Houston,TX,77008,United States,['(713) 868-4111'],[],[],[],,"['Brass', 'Aluminum', 'Lead', 'Scrap Metal', 'Steel', 'Stainless Steel', 'Copper', 'Iron']",[],Aluminum recycling? Gulf Coast Scrap Metal specializes in scrap aluminum recycling. Call (713) 868-4111 today!
YOUR STEEL AND PIPEPARTNER IN ASSET RECOVERY,https://www.rcsteelandpipe.com/,,,,,United States,[],"['feinstein713-992-3676taylor@rcsteelandpipe.comconnect', 'stephen@rcsteelandpipe.com', 'feinstein713-459-8942stephen@rcsteelandpipe.comconnect']",[],[],,"['Iron', 'Steel']",[],"RC Steel and Pipe, your partner in steel and pipe asset recovery based in Houston, TX"
Houston Scrap Metal Removal ~ Texas,https://goloadup.com/houston/scrap-metal-removal/,5708 White Magnolia St.,Houston,TX,77091,United States,"['(844) 239-7711', '(404) 947-6060']",[],[],[],Monday – Sunday 8:00 AM – 8:00 PM EST,"['Appliance', 'Lead', 'Scrap Metal', 'Electronic', 'Iron']",[],"From heavy metal debris to old appliances, we haul it all in Houston, TX. Count on our background-checked team for reliable scrap metal removal and disposal."
Ace Scrap Metal Recycling Co.,https://acescrap.com/,,,,,United States,['(713) 643-9922'],[],[],[],,"['Brass', 'Aluminum', 'Scrap Metal', 'Stainless Steel', 'Copper', 'Steel']",[],
Residential Metal Recycling Services,https://cdscrapmetal.com/residential-metal-recycling/,6775 Bingle Road Houst,on,TX,77092,United States,"['(832) 743-6500', '(281) 524-4458', '(832) 786-8687']",[],[],[],,"['Appliance', 'Brass', 'Aluminum', 'Lead', 'Scrap Metal', 'Steel', 'Stainless Steel', 'Electronic', 'Copper', 'Iron']",[],"Recycle household appliances, brass fixtures, and more. Enjoy competitive pricing and friendly service at our four Houston locations. View our locations."
